{
  "$schema": "https://json-schema.org/draft/2020-12/schema",
  "$id": "https://mrbev02.github.io/klunk/schemas/paper.schema.json",
  "title": "Klunk paper",
  "description": "An exam paper as a selection of bank questions, never as a copy of them. Editing a question in the bank updates every paper that uses it, and the same question can never silently diverge between two papers.",
  "type": "object",
  "required": ["formatVersion", "type", "id", "title", "sections"],
  "additionalProperties": false,

  "properties": {
    "formatVersion": { "const": "1" },
    "type": { "const": "klunk_paper" },

    "id": { "type": "string", "pattern": "^[a-z0-9]+(-[a-z0-9]+)*$" },
    "title": { "type": "string", "minLength": 1 },
    "subtitle": { "type": "string" },

    "profileId": {
      "type": "string",
      "description": "The profile whose rules this paper is checked against. Without it Klunk can still print the paper but cannot tell you the marks are wrong."
    },

    "school": {
      "type": "object",
      "description": "What goes on the cover of this paper in particular. The school's own name and logo live in the folder's school.json; these are the per-paper facts, plus overrides for the two branding fields where one paper genuinely differs.",
      "additionalProperties": false,
      "properties": {
        "name": {
          "type": "string",
          "description": "Overrides school.json for this paper alone, e.g. a campus that prints its own name."
        },
        "course": { "type": "string", "description": "The subject, as printed. 'SCIENCE'." },
        "yearGroup": { "type": "string", "description": "'Year 10', 'Higher level'." },
        "date": { "type": "string" },
        "logoFile": {
          "type": "string",
          "description": "Overrides school.json's logo for this paper alone. Path relative to the paper file, not to school.json, because that is where it sits."
        }
      }
    },

    "readingMinutes": { "type": "number", "minimum": 0 },
    "workingMinutes": { "type": "number", "minimum": 0 },
    "instructions": { "type": "array", "items": { "type": "string" } },

    "status": {
      "type": "string",
      "enum": ["draft", "final", "used"],
      "default": "draft",
      "description": "'used' means it has been sat. Klunk warns before reusing questions from a used paper, which is the mistake that actually happens in a faculty."
    },

    "sections": {
      "type": "array",
      "minItems": 1,
      "items": { "$ref": "#/$defs/section" }
    },

    "notes": { "type": "string", "description": "Teacher-facing. Never printed." }
  },

  "$defs": {
    "section": {
      "type": "object",
      "required": ["refs"],
      "additionalProperties": false,
      "properties": {
        "profileSectionId": {
          "type": "string",
          "description": "Which profile section this fills, so per-section mark and count rules can be checked."
        },
        "title": { "type": "string", "description": "Overrides the profile's section name." },
        "subtitle": { "type": "string" },
        "instructions": { "type": "string" },
        "refs": {
          "type": "array",
          "description": "Questions in the order they appear on the paper.",
          "items": { "$ref": "#/$defs/ref" }
        }
      }
    },

    "ref": {
      "oneOf": [
        {
          "type": "string",
          "pattern": "^[^#]+#.+$",
          "description": "Shorthand: 'bank/design-processes.json#q14', meaning question id q14 in that file, relative to the content folder."
        },
        {
          "type": "object",
          "required": ["file", "questionId"],
          "additionalProperties": false,
          "properties": {
            "file": { "type": "string" },
            "questionId": { "type": "string" },
            "marksOverride": {
              "type": "number",
              "exclusiveMinimum": 0,
              "description": "Use the question but score it differently here. Recorded on the paper, never written back to the bank."
            },
            "group": {
              "type": "string",
              "description": "A heading printed above this question, and above every one after it until another group is named. The 2025 Visual Arts trial heads the pairs of alternatives in its Section II 'Practice', 'Conceptual Framework' and 'Frames', which is how a student choosing one finds it. Held on the paper rather than on the question, because the same question can be filed under a different heading on another paper."
            },
            "stimulusAt": {
              "enum": ["back"],
              "description": "Where this question's pictures print on this paper. Absent means under the question. 'back' moves every image stimulus, the question's and its parts', to a page after the last question headed 'Stimulus for Question N', and prints a line in its place saying where to find it. Text and code stimuli stay with the question, and the marking guide prints everything in place. Held on the paper rather than on the question, because the same picture may fit on the page in another paper."
            },
            "note": { "type": "string", "description": "Teacher-facing. Never printed." }
          }
        }
      ]
    }
  }
}
