{
  "formatVersion": "1",
  "type": "klunk_paper",
  "id": "example-trial-2026",
  "title": "Design and Technology",
  "subtitle": "Trial Higher School Certificate Examination",
  "profileId": "nsw-hsc-design-technology",

  "school": {
    "name": "Example High School",
    "course": "Design and Technology",
    "yearGroup": "Year 12",
    "date": "2026-08-10"
  },

  "status": "draft",

  "sections": [
    {
      "profileSectionId": "I",
      "instructions": "Use the multiple-choice answer sheet for Questions 1-10.",
      "refs": ["src/fixtures/example-bank.json#ex-mc-01"]
    },
    {
      "profileSectionId": "II",
      "refs": [
        "src/fixtures/example-bank.json#ex-sa-01",
        "src/fixtures/example-bank.json#ex-tbl-01",
        {
          "file": "src/fixtures/example-bank.json",
          "questionId": "ex-drw-01",
          "note": "Swap the stimulus image before use."
        }
      ]
    },
    {
      "profileSectionId": "III",
      "refs": ["src/fixtures/example-bank.json#ex-er-01"]
    }
  ],

  "notes": "Fictional fixture for development. Section I is deliberately short: the profile requires 10 questions, so this paper is expected to fail the mark check and is used to prove the checker reports it."
}
